{
  "version": 1,
  "project": {
    "name": "hangman-cli",
    "defaultBranch": "main",
    "prdPattern": "docs/prd*.md"
  },
  "humans": [
    { "login": "KelliherL", "name": "Lachlan", "cli": "claude" }
  ],
  "commands": {
    "setup": "npm ci",
    "test": "npm test",
    "typecheck": "npx tsc --noEmit",
    "lint": "npm run lint"
  },
  "verify": {
    "tool": "codex",
    "model": "gpt-5.6-terra",
    "reasoningEffort": "high",
    "mode": "diff",
    "timeoutMinutes": 15,
    "verdictRequired": {
      "labels": ["core", "infra"],
      "paths": ["src/lib/engine/**", "src/lib/save*", "src/cli*"]
    }
  },
  "board": {
    "owner": "KelliherL",
    "projectNumber": 2,
    "projectId": "PVT_kwHOCrWVts4BevQb",
    "stageFieldId": "PVTSSF_lAHOCrWVts4BevQbzhZHO7c",
    "stageOptionIds": {
      "Backlog": "f55e3d99",
      "Planned": "8334df53",
      "Building": "0f7bd86d",
      "Verifying": "70bb98e9",
      "Human Review": "afe357d1",
      "Done": "d7d0ec19"
    }
  },
  "sessionLogIssue": 1
}
